{
  "schema": "forge.phase-machine/v2",
  "description": "Found-branch delivery: the suite verifies the branch as found, Sol judges it, findings return to Muse for remediation, and a clean verified branch ships. Fast's constitution entered at verify instead of implement.",
  "phases": [
    "implement",
    "verify",
    "review",
    "ship",
    "done",
    "stop"
  ],
  "initial": "verify",
  "terminal": [
    "done",
    "stop"
  ],
  "shippable_from": [
    "review"
  ],
  "rules": [
    {
      "id": "IMPL-BROKEN-TWICE",
      "from": "implement",
      "result": "broken",
      "when": {
        "consecutive_failures_gte": 2
      },
      "next": "stop",
      "severity": "hard",
      "reason": "Two consecutive broken implement runs; stop and report rather than thrash."
    },
    {
      "id": "IMPL-BROKEN-RETRY",
      "from": "implement",
      "result": "broken",
      "next": "implement",
      "reason": "First broken run; one re-run with the specific gap named is permitted."
    },
    {
      "id": "IMPL-BLOCKED",
      "from": "implement",
      "result": "blocked",
      "next": "stop",
      "severity": "hard",
      "reason": "Implementer blocked; report the blocker, never silently continue."
    },
    {
      "id": "IMPL-OK-DOCS-RETURN",
      "from": "implement",
      "result": "complete",
      "when": {
        "fixes_docs_only": true
      },
      "next": "review",
      "reason": "A returned implement changed only the repository's declared docs class; review the answer without rerunning code verification (decision 0041)."
    },
    {
      "id": "IMPL-OK",
      "from": "implement",
      "result": "complete",
      "next": "verify",
      "reason": "Implementation complete and committed."
    },
    {
      "id": "VERIFY-FAIL-EXHAUSTED",
      "from": "verify",
      "result": "fail",
      "when": {
        "visits_implement_gte": 3
      },
      "next": "stop",
      "severity": "hard",
      "reason": "Verification is still red after three implement visits; stop rather than exceed the return bound."
    },
    {
      "id": "VERIFY-FAIL",
      "from": "verify",
      "result": "fail",
      "next": "implement",
      "severity": "flagged",
      "reason": "The suite is red; return its failing output to the implementer who owns the defect (decision 0041)."
    },
    {
      "id": "VERIFY-PASS",
      "from": "verify",
      "result": "pass",
      "next": "review",
      "reason": "Full suite green; reviewers read verified code."
    },
    {
      "id": "REVIEW-SECURITY-HOLD",
      "from": "review",
      "result": "security-hold",
      "next": "stop",
      "severity": "hard",
      "reason": "Unresolved high-severity security findings. NEVER ship. Risk acceptance is the operator's, never an agent's."
    },
    {
      "id": "REVIEW-REFORGE-EXHAUSTED-ABOVE-MEDIUM",
      "from": "review",
      "result": "residual",
      "when": {
        "visits_implement_gte": 3,
        "max_residual_severity_above": "medium"
      },
      "next": "stop",
      "severity": "hard",
      "reason": "Two reforgings spent and the security residual is still above medium; the machine tried, and now the piece is the operator's (decision 0022)."
    },
    {
      "id": "REVIEW-REFORGE-EXHAUSTED-MEDIUM",
      "from": "review",
      "result": "residual",
      "when": {
        "visits_implement_gte": 3,
        "max_residual_severity_above": "low"
      },
      "park": true,
      "reason": "Two reforgings spent and a medium security residual survives; the run parks awaiting the operator, the residual as its reason, so the ruling lands inside the run's journal instead of after its death (decision 0022)."
    },
    {
      "id": "REVIEW-REFORGE-EXHAUSTED-DEBT",
      "from": "review",
      "result": "residual",
      "when": {
        "visits_implement_gte": 3,
        "max_residual_severity_above": "none",
        "max_residual_severity_at_most": "low"
      },
      "next": "ship",
      "severity": "flagged",
      "reason": "Two returns spent; a positively low or info residual ships as tracked debt named in the notes. Silence never earns this arm (decision 0041)."
    },
    {
      "id": "REVIEW-REFORGE",
      "from": "review",
      "result": "residual",
      "when": {
        "max_residual_severity_above": "low"
      },
      "next": "implement",
      "severity": "flagged",
      "reason": "A residual above low, in any dimension, returns to implement while the bounded heats remain (decision 0041)."
    },
    {
      "id": "REVIEW-RESIDUAL-OK",
      "from": "review",
      "result": "residual",
      "when": {
        "max_residual_severity_above": "none",
        "max_residual_severity_at_most": "low"
      },
      "next": "ship",
      "severity": "flagged",
      "reason": "A low or info residual proceeds only as tracked debt named in the notes."
    },
    {
      "id": "REVIEW-CLEAN",
      "from": "review",
      "result": "clean",
      "next": "ship",
      "reason": "Review clean; a gate that moves HEAD parks and ship stops on a dirty tree, so verification evidence stands."
    },
    {
      "id": "SHIP-DRIFT",
      "from": "ship",
      "result": "ready",
      "when": {
        "drift_detected": true
      },
      "next": "review",
      "severity": "flagged",
      "reason": "HEAD moved after the review verdict; re-arm a scoped review (security rides along) before shipping."
    },
    {
      "id": "SHIP-DIRTY",
      "from": "ship",
      "result": "ready",
      "when": {
        "dirty_worktrees": true
      },
      "next": "stop",
      "severity": "hard",
      "reason": "A dirty worktree at ship time is a defect: seats commit their work."
    },
    {
      "id": "SHIP-READY",
      "from": "ship",
      "result": "ready",
      "next": "ship",
      "reason": "Gates passed and ledger written; confirm close-out and report shipped."
    },
    {
      "id": "SHIPPED-DRIFT",
      "from": "ship",
      "result": "shipped",
      "when": {
        "drift_detected": true
      },
      "next": "review",
      "severity": "flagged",
      "reason": "HEAD moved between ready and close-out; re-arm a scoped review (security rides along) before shipping."
    },
    {
      "id": "SHIPPED-DIRTY",
      "from": "ship",
      "result": "shipped",
      "when": {
        "dirty_worktrees": true
      },
      "next": "stop",
      "severity": "hard",
      "reason": "A dirty worktree at close-out is a defect: seats commit their work."
    },
    {
      "id": "SHIP-COMPLETE",
      "from": "ship",
      "result": "shipped",
      "next": "done",
      "reason": "Close-out confirmed: clean tree, review concluded, verification green, no drift. The operator pushes and merges."
    }
  ]
}
