{
  "schema": "forge.phase-machine/v2",
  "description": "Verification bundle: Brokkr's verify and review agents examine an already-delivered change (named in the feature text). No implement, no ship — evidence in, ruling out. The constitutional review invariants hold: review is unavoidable on the path to done, security-hold is a hard stop, security residuals never pass.",
  "phases": ["verify", "review", "done", "stop"],
  "initial": "verify",
  "terminal": ["done", "stop"],
  "shippable_from": ["review"],
  "rules": [
    {
      "id": "VERIFY-FAIL",
      "from": "verify",
      "result": "fail",
      "next": "stop",
      "severity": "hard",
      "reason": "The delivered change does not verify; the ruling is the report."
    },
    {
      "id": "VERIFY-PASS",
      "from": "verify",
      "result": "pass",
      "next": "review",
      "reason": "Checks green; the review agent reads verified evidence."
    },
    {
      "id": "REVIEW-SECURITY-HOLD",
      "from": "review",
      "result": "security-hold",
      "next": "stop",
      "severity": "hard",
      "reason": "Unresolved high-severity security findings in the delivered change. Risk acceptance is the operator's, never an agent's."
    },
    {
      "id": "REVIEW-RESIDUAL-ABOVE-MEDIUM",
      "from": "review",
      "result": "residual",
      "when": { "max_residual_severity_above": "medium" },
      "next": "stop",
      "severity": "hard",
      "reason": "Residual severity above medium; the verification verdict is negative."
    },
    {
      "id": "REVIEW-RESIDUAL-SECURITY",
      "from": "review",
      "result": "residual",
      "when": { "has_security_residual": true },
      "next": "stop",
      "severity": "hard",
      "reason": "Security residuals never qualify as an acceptable verification outcome."
    },
    {
      "id": "REVIEW-RESIDUAL-OK",
      "from": "review",
      "result": "residual",
      "when": { "has_security_residual": false, "max_residual_severity_above": "none" },
      "next": "done",
      "severity": "flagged",
      "reason": "Non-security residuals at or below medium: verified with named tracked debt. A residual that omits its severity or its security flag matches no rule, and the run parks with the notes (decision 0050, ruling 1)."
    },
    {
      "id": "REVIEW-RESIDUAL-NONE",
      "from": "review",
      "result": "residual",
      "when": { "max_residual_severity_at_most": "none" },
      "park": true,
      "reason": "A residual verdict rated none is no verification verdict at all: it names no tracked debt and no defect. The run parks for the operator with the notes (decision 0050, ruling 4)."
    },
    {
      "id": "REVIEW-CLEAN",
      "from": "review",
      "result": "clean",
      "next": "done",
      "reason": "Verified clean. This bundle's reviewer never applies fixes."
    }
  ]
}
